topic_number,top_words
1,"car, like, color, looks, nice, look, looks like, car looks, looking, like car, really, sporty, boring, weird, color car"
2,"car, old, model, probably, design, sports, sports car, think, model car, red, make, old model, doors, family, kind"
3,"looks, like, looks like, car, older, vehicle, shape, model, looking, 80s, older car, vehicle looks, end, odd, sedan"
4,"sedan, door, dark, car, blue, plate, license, gray, license plate, grey, dark blue, silver, black, door sedan, background"
5,"car, good, color, door, older, vehicle, red, appears, trees, lot, model, parked, blue, condition, background"
6,"car, parked, looks, trees, lot, car parked, like, looks like, car looks, sedan, parking, blue, building, parking lot, background"
